{
  "patch": "12.1",
  "season": 2,
  "updatedAt": "2026-09-06",
  "classId": 5,
  "specId": 257,
  "className": "Priest",
  "specName": "Holy",
  "status": "curated",
  "bisCrafts": [
    {
      "slot": "Off-Hand",
      "item": "Aln'hara Lantern (Darkmoon Sigil: Hunt)",
      "notes": "Icy Veins first Spark if you lack a Myth-track off-hand; not strictly BiS vs a Myth OH but close. Method first Spark: Hunt lantern because bonus rolls go to Heroic Ula'tek for Jan'thrazet, the Soul Fang. Two embellishments max. IV: if you lack Myth crests, first craft is a 2H staff with Hunt instead.",
      "sources": [
        { "name": "Icy Veins", "url": "https://www.icy-veins.com/wow/holy-priest-pve-healing-gear-best-in-slot" },
        { "name": "Method", "url": "https://www.method.gg/guides/holy-priest/gearing" }
      ]
    },
    {
      "slot": "Wrist",
      "item": "Martyr's Bindings (Arcanoweave Lining)",
      "notes": "Icy Veins eventual BiS lining once the Myth-track off-hand is upgraded. Method later Spark: move the second lining onto a low stat-budget slot (wrists or cloak). Two embellishments max.",
      "sources": [
        { "name": "Icy Veins", "url": "https://www.icy-veins.com/wow/holy-priest-pve-healing-gear-best-in-slot" },
        { "name": "Method", "url": "https://www.method.gg/guides/holy-priest/gearing" }
      ]
    },
    {
      "slot": "Waist",
      "item": "Martyr's Waistwrap (Arcanoweave Lining)",
      "notes": "Icy Veins other eventual lining BiS. Method second Spark is any high stat-budget armour with Arcanoweave Lining for an immediate spike, then swap that lining onto wrists or cloak later.",
      "sources": [
        { "name": "Icy Veins", "url": "https://www.icy-veins.com/wow/holy-priest-pve-healing-gear-best-in-slot" },
        { "name": "Method", "url": "https://www.method.gg/guides/holy-priest/gearing" }
      ]
    }
  ],
  "bisDrops": {
    "raid": [
      {
        "boss": "Ula'tek",
        "instance": "Venomous Abyss",
        "priority": 1,
        "items": [
          { "slot": "Main Hand", "item": "Jan'thrazet, the Soul Fang" },
          { "slot": "Neck", "item": "Aqirbane Reliquary" },
          { "slot": "Head", "item": "Venomkeeper's Horrific Cowl (catalyze)" }
        ],
        "notes": "IV/Method first three Voidcores: all three drops are season-long. Catalyze the cowl so it keeps the Mastery cantrip as Cosmic Penitent's Truesight Helm. IV/Method raid BiS still catalysts Tidebound Sorcereress's Robes from Nymrissa Wavecaller (S1 leftover).",
        "sources": [
          { "name": "Icy Veins", "url": "https://www.icy-veins.com/wow/holy-priest-pve-healing-gear-best-in-slot" },
          { "name": "Method", "url": "https://www.method.gg/guides/holy-priest/gearing" }
        ]
      },
      {
        "boss": "Nek'zali the Soulcoiler",
        "instance": "Venomous Abyss",
        "priority": 2,
        "items": [
          { "slot": "Trinket", "item": "Soulcoiler Ritual Vessel" },
          { "slot": "Feet", "item": "Nek'zali's Spiritwalkers" },
          { "slot": "Legs", "item": "Initiate's Sacrificial Tights (catalyze)" },
          { "slot": "Back", "item": "Amani Summoning Shawl" }
        ],
        "notes": "Icy Veins S-tier healer trinket; Method S. Raid-only boots. IV/Method raid catalyzes these legs. Method raid BiS cloak; overall Method uses Speakeasy Shroud from Murder Row instead.",
        "sources": [
          { "name": "Icy Veins", "url": "https://www.icy-veins.com/wow/holy-priest-pve-healing-gear-best-in-slot" },
          { "name": "Method", "url": "https://www.method.gg/guides/holy-priest/gearing" }
        ]
      },
      {
        "boss": "The Lost Explorers",
        "instance": "Venomous Abyss",
        "priority": 3,
        "items": [
          { "slot": "Trinket", "item": "Gebbo's Bottomless Bag" },
          { "slot": "Shoulders", "item": "Cosmic Penitent's Echoing Screams (tier token)" }
        ],
        "notes": "Icy Veins A / Method S second raid trinket. IV/Method: take the shoulder token; do not catalyst this slot.",
        "sources": [
          { "name": "Icy Veins", "url": "https://www.icy-veins.com/wow/holy-priest-pve-healing-gear-best-in-slot" },
          { "name": "Method", "url": "https://www.method.gg/guides/holy-priest/gearing" }
        ]
      },
      {
        "boss": "The Coiled Altar",
        "instance": "Venomous Abyss",
        "priority": 4,
        "items": [
          { "slot": "Back", "item": "Silken Voodoo Drape" },
          { "slot": "Feet", "item": "Cackling Soultreads" },
          { "slot": "Hands", "item": "Grasps of the Eternal Shadow (catalyze)" },
          { "slot": "Trinket", "item": "Hex Lord's Dooming Idol" }
        ],
        "notes": "Icy Veins overall cloak and boots. IV raid catalyzes these gloves; Method raid uses the Entombed Sentinels token instead. IV B / Method A Haste idol.",
        "sources": [
          { "name": "Icy Veins", "url": "https://www.icy-veins.com/wow/holy-priest-pve-healing-gear-best-in-slot" },
          { "name": "Method", "url": "https://www.method.gg/guides/holy-priest/gearing" },
          { "name": "Method drops", "url": "https://www.method.gg/guides/all-wow-midnight-season-2-dungeon-and-raid-trinkets" }
        ]
      },
      {
        "boss": "Entombed Sentinels",
        "instance": "Venomous Abyss",
        "priority": 5,
        "items": [
          { "slot": "Wrist", "item": "Venom-Singed Cuffs" },
          { "slot": "Hands", "item": "Cosmic Penitent's Celestial Grips (tier token)" }
        ],
        "notes": "Icy Veins/Method raid wrists if you skip Spark bracers. Method raid BiS catalyzes the Sentinels glove token.",
        "sources": [
          { "name": "Icy Veins", "url": "https://www.icy-veins.com/wow/holy-priest-pve-healing-gear-best-in-slot" },
          { "name": "Method", "url": "https://www.method.gg/guides/holy-priest/gearing" }
        ]
      },
      {
        "boss": "Vashnik the Malignant",
        "instance": "Venomous Abyss",
        "priority": 6,
        "items": [
          { "slot": "Finger", "item": "Vile Alchemist's Band" }
        ],
        "notes": "Icy Veins and Method raid BiS ring. IV overall uses Charged Sandstone Band from Temple of Sethraliss instead.",
        "sources": [
          { "name": "Icy Veins", "url": "https://www.icy-veins.com/wow/holy-priest-pve-healing-gear-best-in-slot" },
          { "name": "Method", "url": "https://www.method.gg/guides/holy-priest/gearing" }
        ]
      },
      {
        "boss": "Sszorak",
        "instance": "Venomous Abyss",
        "priority": 7,
        "items": [
          { "slot": "Finger", "item": "Apex Brute's Claw Ring" }
        ],
        "notes": "Icy Veins and Method raid BiS second ring. Method overall also keeps this with Signet of Snarling Servitude.",
        "sources": [
          { "name": "Icy Veins", "url": "https://www.icy-veins.com/wow/holy-priest-pve-healing-gear-best-in-slot" },
          { "name": "Method", "url": "https://www.method.gg/guides/holy-priest/gearing" }
        ]
      }
    ],
    "mplus": [
      {
        "boss": "Temple of Sethraliss",
        "instance": "Mythic+",
        "priority": 1,
        "items": [
          { "slot": "Finger", "item": "Charged Sandstone Band", "from": "Galvazzt" },
          { "slot": "Chest", "item": "Robes of the Reborn Serpent (catalyze)", "from": "Avatar of Sethraliss" },
          { "slot": "Shoulders", "item": "Brood Cleanser's Amice (catalyze)", "from": "Avatar of Sethraliss" },
          { "slot": "Hands", "item": "Handwraps of Oscillating Polarity (catalyze)", "from": "Galvazzt" },
          { "slot": "Feet", "item": "Sandswept Sandals", "from": "Adderis and Aspix" },
          { "slot": "Wrist", "item": "Bindings of the Slithering Current", "from": "Adderis and Aspix" }
        ],
        "notes": "Icy Veins first farm: Crit/Mastery ring and several high-Crit cloth slots. Method M+ BiS chest, sash (Ouroborial Sash from Merektha), sandals, and this ring. IV M+ wrists live here.",
        "sources": [
          { "name": "Icy Veins", "url": "https://www.icy-veins.com/wow/holy-priest-pve-healing-gear-best-in-slot" },
          { "name": "Method", "url": "https://www.method.gg/guides/holy-priest/gearing" },
          { "name": "Wowhead", "url": "https://www.wowhead.com/guide/midnight/temple-of-sethraliss-dungeon-overview-mythic-plus" }
        ]
      },
      {
        "boss": "Murder Row",
        "instance": "Mythic+",
        "priority": 2,
        "items": [
          { "slot": "Finger", "item": "Signet of Snarling Servitude" },
          { "slot": "Back", "item": "Speakeasy Shroud" },
          { "slot": "Trinket", "item": "Freightrunner's Flask" }
        ],
        "notes": "Icy Veins second farm: Crit/Mastery ring. Method overall/M+ cloak. IV/Method M+ BiS on-use pair with Lightspire Core.",
        "sources": [
          { "name": "Icy Veins", "url": "https://www.icy-veins.com/wow/holy-priest-pve-healing-gear-best-in-slot" },
          { "name": "Method", "url": "https://www.method.gg/guides/holy-priest/gearing" }
        ]
      },
      {
        "boss": "King's Rest",
        "instance": "Mythic+",
        "priority": 3,
        "items": [
          { "slot": "Legs", "item": "Down-Lined Breeches (catalyze)" },
          { "slot": "Head", "item": "Headdress of the First Empire (catalyze)" }
        ],
        "notes": "Icy Veins overall/M+ catalyze legs. IV M+ catalyze helm if you skip Ula'tek's cowl.",
        "sources": [
          { "name": "Icy Veins", "url": "https://www.icy-veins.com/wow/holy-priest-pve-healing-gear-best-in-slot" },
          { "name": "Method", "url": "https://www.method.gg/guides/holy-priest/gearing" }
        ]
      },
      {
        "boss": "The Blinding Vale",
        "instance": "Mythic+",
        "priority": 4,
        "items": [
          { "slot": "Trinket", "item": "Lightspire Core" },